{
  "dataset": "treasury_flows",
  "as_of": "2026-03-20T20:14:44.603849Z",
  "version": 1,
  "routes": [
    {
      "route_id": "gnars-base-117:1",
      "event_at": "2026-03-17T21:26:15+00:00",
      "archive_id": "gnars-base-117",
      "proposal_key": "0x9a39225c12c516a3f3c457fda3dae84cdefd032f6c7cd5e005b6ef72b497f99e",
      "proposal_number": 117,
      "proposal_title": "Sponsor Gnars Monik Santos in QS/WSL 2026",
      "proposal_status": "executed",
      "proposal_chain": "base",
      "project_id": null,
      "project_name": null,
      "proposer_address": "0x25810d1a8b1affc444d5333bf0496f1202d6f89f",
      "recipient_address": "0x25810d1a8b1affc444d5333bf0496f1202d6f89f",
      "recipient_display_name": "0x2581...f89f",
      "asset_symbol": "USDC",
      "amount": 1570.0,
      "asset_kind": "erc20",
      "token_contract": "0x833589fcd6edb6e08f4c7c32d4f71b54bda02913",
      "valuation_reference_at": "2026-03-17T21:26:15+00:00",
      "valuation_date": "2026-03-17",
      "usd_price_at_execution": 1.0,
      "usd_value_at_execution": 1570.0,
      "usd_price_source": "stablecoin-parity",
      "usd_valuation_status": "stablecoin-parity",
      "proposal_href": "https://www.gnars.com/proposals/base/117"
    },
    {
      "route_id": "gnars-base-108:1",
      "event_at": "2025-12-03T12:03:05+00:00",
      "archive_id": "gnars-base-108",
      "proposal_key": "0x4a754d756f79c1f56519653c4080d49c1d1ededbf009d85ea305b402f4ecc1f3",
      "proposal_number": 108,
      "proposal_title": "SKATE ACROSS AFRICA (EAST COAST - SOUTH COAST)",
      "proposal_status": "executed",
      "proposal_chain": "base",
      "project_id": null,
      "project_name": null,
      "proposer_address": "0x8d2a253a5885806aa14e583c80c8833a904fb252",
      "recipient_address": "0x8d2a253a5885806aa14e583c80c8833a904fb252",
      "recipient_display_name": "0x8d2a...b252",
      "asset_symbol": "USDC",
      "amount": 2500.0,
      "asset_kind": "erc20",
      "token_contract": "0x833589fcd6edb6e08f4c7c32d4f71b54bda02913",
      "valuation_reference_at": "2025-12-03T12:03:05+00:00",
      "valuation_date": "2025-12-03",
      "usd_price_at_execution": 1.0,
      "usd_value_at_execution": 2500.0,
      "usd_price_source": "stablecoin-parity",
      "usd_valuation_status": "stablecoin-parity",
      "proposal_href": "https://www.gnars.com/proposals/base/108"
    },
    {
      "route_id": "gnars-base-104:1",
      "event_at": "2025-11-13T13:58:51+00:00",
      "archive_id": "gnars-base-104",
      "proposal_key": "0xe183aa2c4c209bc17df0f2df71bb0dcf104c06905add455ebc9f1ba68db41902",
      "proposal_number": 104,
      "proposal_title": "7Capasmag Skate&Jazz Vol 2 - New Nounstacle inauguration in Devconnect ",
      "proposal_status": "executed",
      "proposal_chain": "base",
      "project_id": null,
      "project_name": null,
      "proposer_address": "0x9ad8d2a8ef4bf60a667dd43fcb178bdbd93ae1c8",
      "recipient_address": "0x9ad8d2a8ef4bf60a667dd43fcb178bdbd93ae1c8",
      "recipient_display_name": "7capas.eth",
      "asset_symbol": "ETH",
      "amount": 0.42,
      "asset_kind": "native",
      "token_contract": null,
      "valuation_reference_at": "2025-11-13T13:58:51+00:00",
      "valuation_date": "2025-11-13",
      "usd_price_at_execution": 3409.614455541162,
      "usd_value_at_execution": 1432.03807133,
      "usd_price_source": "coingecko:ethereum",
      "usd_valuation_status": "historical-price",
      "proposal_href": "https://www.gnars.com/proposals/base/104"
    },
    {
      "route_id": "gnars-base-101:2",
      "event_at": "2025-10-16T16:58:39+00:00",
      "archive_id": "gnars-base-101",
      "proposal_key": "0xbd08e256e964c3228edf5434d30ed3830d632535e9d29976b8641f4e6e5795f4",
      "proposal_number": 101,
      "proposal_title": "Gnars India Initiative: Building Bridges Through Skateboarding",
      "proposal_status": "executed",
      "proposal_chain": "base",
      "project_id": null,
      "project_name": null,
      "proposer_address": "0x49d31dcb59e115f5c9e505a58a323ade076f2176",
      "recipient_address": "0x49d31dcb59e115f5c9e505a58a323ade076f2176",
      "recipient_display_name": "fernandoferreira.eth",
      "asset_symbol": "USDC",
      "amount": 2600.0,
      "asset_kind": "erc20",
      "token_contract": "0x833589fcd6edb6e08f4c7c32d4f71b54bda02913",
      "valuation_reference_at": "2025-10-16T16:58:39+00:00",
      "valuation_date": "2025-10-16",
      "usd_price_at_execution": 1.0,
      "usd_value_at_execution": 2600.0,
      "usd_price_source": "stablecoin-parity",
      "usd_valuation_status": "stablecoin-parity",
      "proposal_href": "https://www.gnars.com/proposals/base/101"
    },
    {
      "route_id": "gnars-base-101:1",
      "event_at": "2025-10-16T16:58:39+00:00",
      "archive_id": "gnars-base-101",
      "proposal_key": "0xbd08e256e964c3228edf5434d30ed3830d632535e9d29976b8641f4e6e5795f4",
      "proposal_number": 101,
      "proposal_title": "Gnars India Initiative: Building Bridges Through Skateboarding",
      "proposal_status": "executed",
      "proposal_chain": "base",
      "project_id": null,
      "project_name": null,
      "proposer_address": "0x49d31dcb59e115f5c9e505a58a323ade076f2176",
      "recipient_address": "0x49d31dcb59e115f5c9e505a58a323ade076f2176",
      "recipient_display_name": "fernandoferreira.eth",
      "asset_symbol": "ETH",
      "amount": 0.619,
      "asset_kind": "native",
      "token_contract": null,
      "valuation_reference_at": "2025-10-16T16:58:39+00:00",
      "valuation_date": "2025-10-16",
      "usd_price_at_execution": 3983.154435689423,
      "usd_value_at_execution": 2465.57259569,
      "usd_price_source": "coingecko:ethereum",
      "usd_valuation_status": "historical-price",
      "proposal_href": "https://www.gnars.com/proposals/base/101"
    },
    {
      "route_id": "gnars-base-99:1",
      "event_at": "2025-10-06T13:31:11+00:00",
      "archive_id": "gnars-base-99",
      "proposal_key": "0x787e8c217fbb871dde6e4c164f616d9dae47ba3779f3e6ff741ca35ccc6b09e0",
      "proposal_number": 99,
      "proposal_title": "Gnars Crew at Devconnect Buenos Aires 2025 – Skate + Hacker House",
      "proposal_status": "executed",
      "proposal_chain": "base",
      "project_id": null,
      "project_name": null,
      "proposer_address": "0x39a7b6fa1597bb6657fe84e64e3b836c37d6f75d",
      "recipient_address": "0x39a7b6fa1597bb6657fe84e64e3b836c37d6f75d",
      "recipient_display_name": "r4topunk",
      "asset_symbol": "ETH",
      "amount": 1.0,
      "asset_kind": "native",
      "token_contract": null,
      "valuation_reference_at": "2025-10-06T13:31:11+00:00",
      "valuation_date": "2025-10-06",
      "usd_price_at_execution": 4515.321391965295,
      "usd_value_at_execution": 4515.32139197,
      "usd_price_source": "coingecko:ethereum",
      "usd_valuation_status": "historical-price",
      "proposal_href": "https://www.gnars.com/proposals/base/99"
    },
    {
      "route_id": "gnars-base-97:2",
      "event_at": "2025-08-31T23:49:21+00:00",
      "archive_id": "gnars-base-97",
      "proposal_key": "0x8edf483d084d949ac22121fb243a6657082de4f9f51b6992b65a1534d84f1ca1",
      "proposal_number": 97,
      "proposal_title": "Pod Media Proposal 3.0",
      "proposal_status": "executed",
      "proposal_chain": "base",
      "project_id": null,
      "project_name": null,
      "proposer_address": "0x2feb329b9289b60064904fa61fc347157a5aed6a",
      "recipient_address": "0xe5f6202ff7ddc5273c249073865bc6f4d5d68beb",
      "recipient_display_name": "0xe5f6...8beb",
      "asset_symbol": "USDC",
      "amount": 780.0,
      "asset_kind": "erc20",
      "token_contract": "0x833589fcd6edb6e08f4c7c32d4f71b54bda02913",
      "valuation_reference_at": "2025-08-31T23:49:21+00:00",
      "valuation_date": "2025-08-31",
      "usd_price_at_execution": 1.0,
      "usd_value_at_execution": 780.0,
      "usd_price_source": "stablecoin-parity",
      "usd_valuation_status": "stablecoin-parity",
      "proposal_href": "https://www.gnars.com/proposals/base/97"
    },
    {
      "route_id": "gnars-base-97:1",
      "event_at": "2025-08-31T23:49:21+00:00",
      "archive_id": "gnars-base-97",
      "proposal_key": "0x8edf483d084d949ac22121fb243a6657082de4f9f51b6992b65a1534d84f1ca1",
      "proposal_number": 97,
      "proposal_title": "Pod Media Proposal 3.0",
      "proposal_status": "executed",
      "proposal_chain": "base",
      "project_id": null,
      "project_name": null,
      "proposer_address": "0x2feb329b9289b60064904fa61fc347157a5aed6a",
      "recipient_address": "0xe5f6202ff7ddc5273c249073865bc6f4d5d68beb",
      "recipient_display_name": "0xe5f6...8beb",
      "asset_symbol": "ETH",
      "amount": 1.0,
      "asset_kind": "native",
      "token_contract": null,
      "valuation_reference_at": "2025-08-31T23:49:21+00:00",
      "valuation_date": "2025-08-31",
      "usd_price_at_execution": 4373.360357620914,
      "usd_value_at_execution": 4373.36035762,
      "usd_price_source": "coingecko:ethereum",
      "usd_valuation_status": "historical-price",
      "proposal_href": "https://www.gnars.com/proposals/base/97"
    },
    {
      "route_id": "gnars-base-95:1",
      "event_at": "2025-08-05T19:12:29+00:00",
      "archive_id": "gnars-base-95",
      "proposal_key": "0x4dd4ac362db15656ec5cac3302daea7bc033fc9e6cc99636c22f3a9de7bf4ca9",
      "proposal_number": 95,
      "proposal_title": "Funding Katwe Parkour Culture to make the DIY Parkour Equipments",
      "proposal_status": "executed",
      "proposal_chain": "base",
      "project_id": null,
      "project_name": null,
      "proposer_address": "0xddd7c01cecdbd0ac633ef7405a60165f731e645f",
      "recipient_address": "0xd2d164aea2a354e46ee3cf207899f48e5432b968",
      "recipient_display_name": "0xd2d1...b968",
      "asset_symbol": "USDC",
      "amount": 1200.0,
      "asset_kind": "erc20",
      "token_contract": "0x833589fcd6edb6e08f4c7c32d4f71b54bda02913",